{
  "schema": "rusty.quest.sidecar.manifold_public_derivative_schema_slice_response_submission_intake_response_implementation_preflight.v1",
  "preflight_id": "preflight.manifold_public_derivative_schema_slice_response_submission_intake_response_implementation.synthetic.001",
  "generated_at": "2026-06-05T01:36:00Z",
  "preflight_status": "ready_for_manifold_submission_intake_response_implementation_planning",
  "source_submission_intake_response_expectation": {
    "path": "fixtures/valid/manifold-public-derivative-schema-slice-response-submission-intake-response-expectation.synthetic.json",
    "schema": "rusty.quest.sidecar.manifold_public_derivative_schema_slice_response_submission_intake_response_expectation.v1",
    "expectation_id": "expectation.manifold_public_derivative_schema_slice_response_submission_intake_response.synthetic.001",
    "expectation_status": "ready_for_manifold_submission_intake_response",
    "next_gate": "operator_submission_envelope_or_manifold_repo_submission_intake_response"
  },
  "implementation_preflight_scope": {
    "preflight_class": "manifold_repo_submission_intake_response_preflight",
    "source_mode": "synthetic_fixture",
    "target_repo": "rusty.manifold",
    "repo_touch_status": "not_touched",
    "branch_status": "not_created",
    "implementation_plan_status": "not_created",
    "submission_envelope_status": "not_created",
    "submission_status": "not_submitted",
    "intake_response_status": "not_created",
    "decision_status": "not_decided",
    "response_schema_status": "not_created",
    "route_status": "not_created",
    "accepted_state_status": "not_created",
    "audit_record_status": "not_created",
    "validation_report_status": "not_created",
    "public_derivative_status": "not_created",
    "hostess_boundary_descriptor_status": "not_created",
    "hostess_route_status": "not_created",
    "hostess_input_status": "not_created",
    "live_evidence_status": "not_included",
    "adb_status": "not_used",
    "command_status": "no_commands"
  },
  "authority": {
    "preflight_owner": "rusty.quest.sidecar_mesh",
    "submission_envelope_owner": "operator",
    "submission_request_owner": "operator",
    "intake_response_implementation_owner": "rusty.manifold",
    "intake_response_owner": "rusty.manifold",
    "submission_acceptance_owner": "rusty.manifold",
    "decision_owner": "rusty.manifold",
    "response_schema_owner": "rusty.manifold",
    "route_implementation_owner": "rusty.manifold",
    "runtime_authority_owner": "rusty.manifold",
    "session_authority_owner": "rusty.manifold",
    "audit_owner": "rusty.manifold.audit",
    "accepted_state_owner": "rusty.manifold",
    "validation_report_owner": "rusty.manifold",
    "rollback_owner": "rusty.manifold",
    "source_chain_digest_owner": "rusty.manifold",
    "redaction_review_input_owner": "operator",
    "redaction_review_validation_owner": "rusty.manifold",
    "hostess_boundary_descriptor_owner": "rusty.manifold",
    "future_hostess_route_owner": "rusty.hostess",
    "hostess_device_action_authority": "not_in_sidecar",
    "sidecar_role": "observer_proposer",
    "proposal_status": "not_accepted"
  },
  "manifold_repo_submission_intake_response_requirements": {
    "slice_class": "manifold_owned_submission_intake_response",
    "target_repo": "rusty.manifold",
    "implementation_status": "not_created_by_sidecar",
    "required_manifold_owned_artifacts": [
      {
        "artifact_id": "artifact.submission_intake_response_schema",
        "artifact_kind": "response_schema",
        "owner": "rusty.manifold",
        "status": "not_created_by_sidecar",
        "evidence_source": "expected_manifold_intake_response.required_fields"
      },
      {
        "artifact_id": "artifact.submission_intake_response_route_handler",
        "artifact_kind": "route_handler",
        "owner": "rusty.manifold",
        "status": "not_created_by_sidecar",
        "evidence_source": "expected_manifold_intake_response.allowed_decisions"
      },
      {
        "artifact_id": "artifact.submission_intake_decision_event_schema",
        "artifact_kind": "decision_event_schema",
        "owner": "rusty.manifold",
        "status": "not_created_by_sidecar",
        "evidence_source": "expected_manifold_intake_response.decision"
      },
      {
        "artifact_id": "artifact.submission_envelope_schema_binding",
        "artifact_kind": "submission_envelope_schema_binding",
        "owner": "rusty.manifold",
        "status": "not_created_by_sidecar",
        "evidence_source": "source_submission_envelope_expectation"
      },
      {
        "artifact_id": "artifact.submission_intake_accepted_state_candidate_fixture",
        "artifact_kind": "accepted_state_candidate_fixture",
        "owner": "rusty.manifold",
        "status": "not_created_by_sidecar",
        "evidence_source": "manifold_acceptance_after_response.accepted_state_status"
      },
      {
        "artifact_id": "artifact.submission_intake_audit_fixture",
        "artifact_kind": "audit_fixture",
        "owner": "rusty.manifold.audit",
        "status": "not_created_by_sidecar",
        "evidence_source": "manifold_acceptance_after_response.audit_record_status"
      },
      {
        "artifact_id": "artifact.submission_intake_validation_report_fixture",
        "artifact_kind": "validation_report_fixture",
        "owner": "rusty.manifold",
        "status": "not_created_by_sidecar",
        "evidence_source": "manifold_acceptance_after_response.validation_report_status"
      },
      {
        "artifact_id": "artifact.submission_intake_rejection_fixture",
        "artifact_kind": "rejection_fixture",
        "owner": "rusty.manifold",
        "status": "not_created_by_sidecar",
        "evidence_source": "expected_manifold_intake_response.allowed_decisions"
      },
      {
        "artifact_id": "artifact.submission_intake_revision_fixture",
        "artifact_kind": "revision_fixture",
        "owner": "rusty.manifold",
        "status": "not_created_by_sidecar",
        "evidence_source": "expected_manifold_intake_response.allowed_decisions"
      },
      {
        "artifact_id": "artifact.submission_intake_hostess_boundary_descriptor",
        "artifact_kind": "hostess_boundary_descriptor",
        "owner": "rusty.manifold",
        "status": "not_created_by_sidecar",
        "evidence_source": "hostess_boundary_after_response"
      },
      {
        "artifact_id": "artifact.submission_intake_rollback_descriptor",
        "artifact_kind": "rollback_descriptor",
        "owner": "rusty.manifold",
        "status": "not_created_by_sidecar",
        "evidence_source": "validation_evidence.future_manifold_gate"
      }
    ],
    "required_validation_slots": [
      "slot.submission_intake_response_expectation_contract",
      "slot.submission_intake_response_schema_contract",
      "slot.submission_intake_received_for_review_fixture",
      "slot.submission_intake_revision_request_fixture",
      "slot.submission_intake_rejection_fixture",
      "slot.submission_intake_audit_fixture",
      "slot.submission_intake_validation_report_fixture",
      "slot.source_chain_digest_check",
      "slot.redaction_review_status_check",
      "slot.hostess_boundary_descriptor_check",
      "slot.no_private_endpoint_or_command_content",
      "slot.sidecar_non_authority_check"
    ],
    "required_response_decisions": [
      "received_for_review",
      "request_submission_revision",
      "reject_submission_envelope"
    ],
    "required_rejection_terms": [
      "missing_operator_submission_envelope",
      "invalid_submission_envelope",
      "source_chain_incomplete",
      "redaction_incomplete",
      "endpoint_values_rejected",
      "commands_rejected",
      "adb_rejected",
      "raw_logs_rejected",
      "visual_captures_rejected",
      "private_device_ids_rejected",
      "hostess_direct_action_rejected",
      "stale_handoff_package",
      "untrusted_sidecar"
    ],
    "required_revision_terms": [
      "submission_envelope_revision",
      "validation_report_revision",
      "redaction_summary_revision",
      "source_chain_digest_revision",
      "hostess_boundary_intent_revision",
      "reason_revision"
    ],
    "required_audit_terms": [
      "response_id",
      "submission_envelope_id",
      "source_handoff_package_id",
      "decision",
      "reason",
      "validation_report_ref",
      "audit_record_ref",
      "source_chain_digest_status",
      "redaction_review_status",
      "hostess_boundary_intent"
    ],
    "required_route_boundaries": {
      "input_payload_class": "low_rate_descriptor",
      "accepts_sanitized_summary_only": true,
      "requires_operator_submission_envelope": true,
      "requires_source_chain_digest": true,
      "requires_redaction_review": true,
      "allows_endpoint_values": false,
      "allows_commands": false,
      "allows_adb": false,
      "allows_raw_logs": false,
      "allows_visual_captures": false,
      "allows_private_device_ids": false,
      "allows_high_rate_payloads": false,
      "allows_sidecar_direct_hostess_input": false,
      "creates_response_by_sidecar": false,
      "creates_accepted_state_by_sidecar": false,
      "creates_audit_by_sidecar": false,
      "creates_validation_report_by_sidecar": false,
      "creates_hostess_input": false,
      "accepted_state_owner": "rusty.manifold",
      "audit_owner": "rusty.manifold.audit"
    },
    "rollback_policy": "manifold_owned_reject_submission_or_request_revision"
  },
  "hostess_boundary_preflight": {
    "status": "future_lane_not_requested",
    "route_status": "not_created",
    "input_status": "not_created",
    "recovery_request_status": "not_created",
    "device_action_authority": "not_in_sidecar",
    "future_route_owner": "rusty.hostess",
    "boundary_descriptor_owner": "rusty.manifold",
    "consumes_only": "manifold_accepted_state_or_explicit_operator_request_descriptor",